Sheet: Sheet1
B2: part | C2: count | D2: 1 pc price | E2: 1 pc total | F2: 10 pcs price | G2: 10 pcs total | H2: 100 pcs price | I2: 100 pcs total | K2: Note
B3: DF40C-100DS-0.4V | C3: 2 | D3: 1.59 | E3: of:=[.D3]*[.C3] -> 3.18 | F3: 1.3 | G3: of:=[.F3]*[.C3] -> 2.6 | H3: 1.12 | I3: of:=[.H3]*[.C3] -> 2.24 | K3: CM4 GPIO
B4: LAN8720 | C4: 1 | D4: 1.2 | E4: of:=[.D4]*[.C4] -> 1.2 | F4: 1.2 | G4: of:=[.F4]*[.C4] -> 1.2 | H4: 1 | I4: of:=[.H4]*[.C4] -> 1 | K4: LAN PHY
B5: MPM3833 | C5: 1 | D5: 2.49 | E5: of:=[.D5]*[.C5] -> 2.49 | F5: 2.12 | G5: of:=[.F5]*[.C5] -> 2.12 | H5: 1.83 | I5: of:=[.H5]*[.C5] -> 1.83 | K5: DC-DC
B6: TLV62569 | C6: 4 | D6: 0.419 | E6: of:=[.D6]*[.C6] -> 1.676 | F6: 0.32 | G6: of:=[.F6]*[.C6] -> 1.28 | H6: 0.199 | I6: of:=[.H6]*[.C6] -> 0.796 | K6: LDO
B7: CCGM1A1 | C7: 1 | D7: 0 | E7: of:=[.D7]*[.C7] -> 0 | F7: 0 | G7: of:=[.F7]*[.C7] -> 0 | H7: 0 | I7: of:=[.H7]*[.C7] -> 0 | K7: FPGA
B8: PCB (lead-free) | C8: 1 | D8: 2.36 | E8: of:=[.D8]*[.C8] -> 2.36 | F8: 1.79 | G8: of:=[.F8]*[.C8] -> 1.79 | H8: 0.475 | I8: of:=[.H8]*[.C8] -> 0.475 | K8: PCB
B9: W25Q64JW | C9: 1 | D9: 1.09 | E9: of:=[.D9]*[.C9] -> 1.09 | F9: 0.995 | G9: of:=[.F9]*[.C9] -> 0.995 | H9: 0.86 | I9: of:=[.H9]*[.C9] -> 0.86 | K9: Flash
B10: SN74AUC00 | C10: 1 | D10: 0.577 | E10: of:=[.D10]*[.C10] -> 0.577 | F10: 0.463 | G10: of:=[.F10]*[.C10] -> 0.463 | H10: 0.344 | I10: of:=[.H10]*[.C10] -> 0.344 | K10: NAND
B11: SN74LVC1GU04DRL | C11: 2 | D11: 0.409 | E11: of:=[.D11]*[.C11] -> 0.818 | F11: 0.312 | G11: of:=[.F11]*[.C11] -> 0.624 | H11: 0.177 | I11: of:=[.H11]*[.C11] -> 0.354 | K11: Inverter
B12: CAS-120A1 | C12: 1 | D12: 1.04 | E12: of:=[.D12]*[.C12] -> 1.04 | F12: 0.93 | G12: of:=[.F12]*[.C12] -> 0.93 | H12: 0.884 | I12: of:=[.H12]*[.C12] -> 0.884 | K12: Switch
B13: PCA9306 | C13: 1 | D13: 0.791 | E13: of:=[.D13]*[.C13] -> 0.791 | F13: 0.675 | G13: of:=[.F13]*[.C13] -> 0.675 | H13: 0.531 | I13: of:=[.H13]*[.C13] -> 0.531 | K13: I2C Levelshifter
B14: 22-03-2031 | C14: 1 | D14: 0.316 | E14: of:=[.D14]*[.C14] -> 0.316 | F14: 0.241 | G14: of:=[.F14]*[.C14] -> 0.241 | H14: 0.166 | I14: of:=[.H14]*[.C14] -> 0.166 | K14: Vcore Pin Header
B15: USB3343 | C15: 1 | D15: 1.61 | E15: of:=[.D15]*[.C15] -> 1.61 | F15: 1.61 | G15: of:=[.F15]*[.C15] -> 1.61 | H15: 1.35 | I15: of:=[.H15]*[.C15] -> 1.35 | K15: USB PHY
B16: W956D8MB | C16: 1 | D16: 1.87 | E16: of:=[.D16]*[.C16] -> 1.87 | F16: 1.71 | G16: of:=[.F16]*[.C16] -> 1.71 | H16: 1.48 | I16: of:=[.H16]*[.C16] -> 1.48 | K16: RAM
E17: of:=[.D17]*[.C17] -> 0 | G17: of:=[.F17]*[.C17] -> 0 | I17: of:=[.H17]*[.C17] -> 0 | K17: Clock
B18: Assembly | C18: 1 | E18: of:=[.D18]*[.C18] -> 0 | G18: of:=[.F18]*[.C18] -> 0 | I18: of:=[.H18]*[.C18] -> 0 | K18: Assembly
B20: Einzelkosten | E20: of:=SUM([.E3:.E18]) -> 19.018 | G20: of:=SUM([.G3:.G18]) -> 16.238 | I20: of:=SUM([.I3:.I18]) -> 12.31
B21: Erw. Kosten | E21: of:=[.E20]*1 -> 19.018 | G21: of:=[.G20]*10 -> 162.38 | I21: of:=[.I20]*100 -> 1231